[
    {
        "name": "Lethal Company",
        "slug": "lethal-company",
        "loader": {
            "name": "BepInEx"
        },
        "platforms": {
            "steam": {
                "id": 1966720
            }
        }
    },
    {
        "name": "R.E.P.O.",
        "slug": "repo",
        "loader": {
            "name": "BepInEx"
        },
        "platforms": {
            "steam": {
                "id": 3241660
            }
        }
    },
    {
        "name": "Valheim",
        "slug": "valheim",
        "loader": {
            "name": "BepInEx",
            "packageOverride": "denikson-BepInExPack_Valheim"
        },
        "platforms": {
            "steam": {
                "id": 892970
            }
        }
    }
]
